{
  "schemaVersion": 1,
  "result": "status",
  "mode": "live",
  "generatedAt": "2026-07-21T05:00:00.000Z",
  "status": {
    "source": {"id": "1111111111111111111111111111111111111111111111111111111111111111", "kind": "git", "display": "git.example/ops/checksy#main"},
    "current": {"revision": "1111111111111111111111111111111111111111", "providerGeneration": null, "signer": {"kind": "ssh", "principal": "release@example.test", "keySha256": "4444444444444444444444444444444444444444444444444444444444444444", "signedObject": "commit"}, "verifiedAt": "2026-07-21T01:00:00.000Z"},
    "previous": null,
    "lastAttempt": {"attemptId": "5555555555555555555555555555555555555555555555555555555555555555", "startedAt": "2026-07-21T01:00:00.000Z", "finishedAt": "2026-07-21T01:00:01.000Z", "outcome": "success", "exitCode": 0, "revision": "1111111111111111111111111111111111111111", "offline": false, "rollback": false, "sourceChanged": true, "promoted": true, "error": null},
    "lastSuccess": {"at": "2026-07-21T01:00:01.000Z", "revision": "1111111111111111111111111111111111111111", "compliance": "compliant", "offline": false, "promoted": true},
    "lastError": null,
    "recordedCompliance": {"state": "compliant", "revision": "1111111111111111111111111111111111111111", "checkedAt": "2026-07-21T01:00:01.000Z", "offline": false, "failSeverity": "error", "failingRules": 0, "degradedRules": 0, "counts": {"debug": 0, "info": 0, "warn": 0, "error": 0}},
    "observedCompliance": {"state": "degraded", "revision": "1111111111111111111111111111111111111111", "checkedAt": "2026-07-21T05:00:00.000Z", "offline": false, "failSeverity": "error", "failingRules": 0, "degradedRules": 1, "counts": {"debug": 0, "info": 0, "warn": 1, "error": 0}}
  },
  "error": null
}
